{
  "version": "0.1.0",
  "id": "pcap-002",
  "action": { "name": "update_api", "params": { "endpoint": "/v1/items" }, "target": "repo://api/routes.py" },
  "context_hash": "ffffffffffffffffffffffffffffffffffffffffffffffffffffffffffffffff",
  "obligations": ["k-semver-1"],
  "justification": { "time_ms": 1500, "audit_cost": 0.3, "security_risk": 0.1, "info_loss": 0.0, "tech_debt": 0.2 },
  "proofs": [
    { "id": "p-7", "type": "static_analysis", "runner": "ruff", "args": ["--select=E,F","api/"], "expect": "clean" }
  ],
  "attestation": { "verdict": "accepted", "ts": "2025-09-26T09:00:00Z", "signature": "sig:local" }
}